title,id,authors,abstract,journal,published
Experimental Studies of Electroweak Physics,http://arxiv.org/abs/hep-ex/9801001v1,['Erez Etzion'],"  Some experimental new Electroweak physics results measured at the LEP/SLD and
the TEVATRON are discussed. The excellent accuracy achieved by the experiments
still yield no significant evidence for deviation from the Standard Model
predictions, or signal to physics beyond the Standard Model. The Higgs particle
still has not been discovered and a low bound is given to its mass.
",None,1998-01-01 15:13:52+00:00
Electron-photon interactions in high energy beam production and cooling,http://arxiv.org/abs/hep-ex/9805002v2,['Valery Telnov'],"  In this review we consider three important applications of lasers in high
energy physics: gamma gamma, gamma electron colliders, laser cooling, positron
production. These topics are actual now due to plans of construction linear
e+e-, e-e-, gamma-gamma, gamma-e colliders with energies 0.3--1 TeV. High
energy photons for gamma-gamma, gamma-e collisions can be obtained using laser
backscattering. These types of collisions considerably increase physics
potential of linear colliders. Very low emittance of electron beams required
for achieving ultimate gamma-gamma luminosity can be obtained using a laser
cooling of electron beams. Combining a laser-electron Compton scattering with
subsequent conversion of these photons to e+e- pairs on the target (it can be a
laser target) one can get a nice source of polarized positron. In this paper,
we briefly consider these subjects with emphasis on underlying physics of
photon-electron interactions.
","QUANTUM ASPECTS OF BEAM PHYSICS: Proceedings, Ed. by P.Chen,
  Singapore, World Scientific, 1998, p.173.",1998-05-02 11:04:43+00:00
"Muon Colliders: New Prospects for Precision Physics and the High Energy
  Frontier",http://arxiv.org/abs/hep-ex/9908041v1,['Bruce J. King'],"  An overview is given of muon collider technology and of the current status of
the muon collider research program. The exciting potential of muon colliders
for both neutrino physics and collider physics studies is then described and
illustrated using self-consistent collider parameter sets at 0.1 TeV to 100 TeV
center-of-mass energies.
","AIPConf.Proc.444:503-519,1998",1999-08-08 15:28:31+00:00
TESLA*HERA as Lepton (Photon)-Hadron Collider,http://arxiv.org/abs/hep-ex/0004013v1,"['O. Yavas', 'A. K. Ciftci', 'S. Sultansoy']","  New facilities for particle and nuclear physics research, which will be
available due to constructing the TESLA linear electron-positron collider
tangentially to the HERA proton ring, are discussed.
",None,2000-04-11 10:23:10+00:00
TESLA*HERA Based gamma-p and gamma-A Colliders,http://arxiv.org/abs/hep-ex/0007009v1,"['A. K. Ciftci', 'S. Sultansoy', 'O. Yavas']","  Main parameters and physics search potential of gamma-p and gamma-A
colliders, which will be available due to constructing the TESLA linear
electron-positron collider tangentially to the HERA proton ring, are discussed.
","Nucl.Instrum.Meth.A472:72-78,2001",2000-07-05 18:49:14+00:00
Mini-Review on Extra Dimensions,http://arxiv.org/abs/hep-ex/0009038v1,['Greg Landsberg'],"  One of the most stimulating recent ideas in particle physics involves a
possibility that our universe has additional compactified spatial dimensions,
perhaps as large as 1 mm. In this mini-review, we discuss the results of recent
experimental searches for such large extra dimensions.
",None,2000-09-14 23:06:44+00:00
Physics at TESLA,http://arxiv.org/abs/hep-ex/0104044v1,['Grahame A. Blair'],"  The physics at a 500-800 GeV electron positron linear collider, TESLA, is
reviewed. The machine parameters that impact directly on the physics are
discussed and a few key performance goals for a detector at TESLA are given.
Emphasis is placed on precision measurements in the Higgs and top sectors and
on extrapolation to high energy scales in the supersymmetric scenario.
",None,2001-04-25 09:17:30+00:00
Zeus at HERA II,http://arxiv.org/abs/hep-ex/0107066v1,['B. Foster'],"  The ZEUS detector has been upgraded in a number of areas to prepare for the
physics opportunities of HERA II. These upgrades, and their physics rationale
and promise, are briefly outlined. The measurement of polarisation at HERA II,
and its importance for the HERA II physics programme, is also discussed.
",None,2001-07-24 10:17:50+00:00
An Asymmetric e+e- Collider at the psi'',http://arxiv.org/abs/hep-ex/0111043v1,"['Daniel M. Kaplan', 'Bruce C. Brown', 'Harry N. Nelson']","  A highly-asymmetric ""psi'' factory"" may be the best approach for studying D0
anti-D0 mixing.
","eConf C010630:E205,2001",2001-11-12 18:53:31+00:00
Diffractive Physics in the Near Future,http://arxiv.org/abs/hep-ex/0203028v1,['Gilvan A. Alves'],"  This Paper summarize the present status and near term perspectives for
Diffractive Physics at Tevatron. We describe the new detectors that are being
installed around the CDF and D0 interaction regions, and discuss he physics
topics accessible in view of these upgrades.
","Lect.Notes Phys.616:175-187,2003",2002-03-19 15:25:35+00:00
The BTeV experiment at the Tevatron collider,http://arxiv.org/abs/hep-ex/0207009v1,['J. C. Wang'],"  The BTeV experiment is designed to study beauty and charm physics at the
Fermilab Tevatron collider. The goals are to make an exhaustive search for
physics beyond the Standard Model and make precise measurements of the SM
parameters. The description of the detector and the physics reach are
presented.
",None,2002-07-01 16:16:40+00:00
Low x Physics At HERA,http://arxiv.org/abs/hep-ex/0208043v1,['Robin Devenish'],"  Data on low x physics from H1 & ZEUS are presented and their interpretation
discussed. The focus is on the increasing hardness of the energy dependence of
inclusive virtual-photon proton scattering and certain diffractive processes as
the transverse size of the probe decreases.
","eConf C020620:FRBT01,2002",2002-08-27 09:48:15+00:00
Physics Results and Future Plans of the ZEUS Experiment,http://arxiv.org/abs/hep-ex/0209012v1,['J. Chwastowski'],"  Selected ZEUS results on the proton and the photon structures are presented.
A short outline of the future measurements, the HERA machine and the ZEUS
detector status is given.
",None,2002-09-07 12:01:28+00:00
Probing Physics Beyond the SM at Tevatron,http://arxiv.org/abs/hep-ex/0209034v1,['C. Pagliarone'],"  Tevatron Experiments: CDF and D$\not$O collected during October 1992 and
February 1996 (Run I) a data sample of roughly 120 $pb^{-1}$ $ p \bar{p}$
collisions at a center of mass energy $\sqrt{s}=$ 1.8 TeV. A large variety of
physical studies have been performed using these data. Current paper reviews
last results obtained searching for physics beyond the Standard Model. Direct
Supersymmetry (SUSY) searches are not part of this review.
",None,2002-09-16 23:00:18+00:00
Tau physics at LEP,http://arxiv.org/abs/hep-ex/0211054v1,['F. Matorras'],"  This paper gives an overview of some of the more interesting results obtained
at LEP in tau physics: precision measurements in neutral and charged currents
universality and structure, tau mass, topological and exclusive Branching
Ratios.
",eConf C0209101 (2002) TU02,2002-11-21 15:39:36+00:00
Jet Physics at HERA,http://arxiv.org/abs/hep-ex/0211063v1,['O. Gonzalez'],"  Analyses of jet production at HERA have become precise enough to perform QCD
studies which are both competitive and complementary to those at e+e- and
p-pbar colliders. This report summarises some of the latest results on jet
physics from the H1 and ZEUS Collaborations.
",None,2002-11-26 19:15:08+00:00
Tevatron Physics,http://arxiv.org/abs/hep-ex/0301007v2,['John Womersley'],"  These lectures form a personal, and not necessarily comprehensive, survey of
physics at the Fermilab Tevatron proton-antiproton collider. They cover
detectors, analysis issues, and physics prospects for the current Tevatron run.
(Version 2 has typographic corrections).
",None,2003-01-09 00:43:20+00:00
Linac-Ring Type Colliders: Second Way to TeV Scale,http://arxiv.org/abs/hep-ex/0306034v2,['Saleh Sultansoy'],"  Main parameters and the physics search potentials of the linac-ring type
lepton-hadron and photon-hadron colliders are discussed. The THERA (TESLA on
HERA), NLC-LHC and CLIC-VLHC proposals are considered.
","Eur.Phys.J.C33:s1064-s1066,2004",2003-06-16 11:23:13+00:00
Recent measurements of CP violation at the B factories,http://arxiv.org/abs/hep-ex/0307045v1,['Gabriella Sciolla'],"  Recent measurements of time dependent CP asymmetries at the B factories have
led to substantial progress in our understanding of CP violation. In this
article, I review some of these experimental results and discuss their
implications in the Standard Model and their sensitivity to New Physics.
","Mod.Phys.Lett.A18:2083-2098,2003",2003-07-16 22:55:08+00:00
Jet Physics at Tevatron,http://arxiv.org/abs/hep-ex/0401020v1,['Giuseppe Latino'],"  An overview of Run I jet physics at the ppbar Fermilab Tevatron Collider with
a particular emphasis on inclusive jet cross section measurements is given. The
impact of these studies on PDFs constrain from global fits is underlined.
Preliminary results on inclusive jet and di-jet mass cross section measurements
in Run II are then summarized.
",None,2004-01-15 23:34:17+00:00
Recent Results of High $p_{T}$ Physics at the CDF II,http://arxiv.org/abs/hep-ex/0502016v1,['Soushi Tsuno'],"  The Tevatron Run II program is in progress since 2001. The CDF experiment
have accumulated roughly five times more data than in Run I, with much improved
detectors. Preliminary results from the CDF experiment are presented. We focus
on the recent high $p_{T}$ physics results in Tevatron Run II program.
",None,2005-02-08 01:02:05+00:00
Experimental Status of Beyond the Standard Model Collider Searches,http://arxiv.org/abs/hep-ex/0505003v1,['M. Spiropulu'],"  This is a brief review of experimental strategies for physics beyond the
Standard Model based on the talk given in the ``Physics at LHC'' in Vienna,
July 2004 \cite{vienna}. The emphasis is on Tevatron thematology and
experience.
",Czech.J.Phys. 55 (2005) B599-B612,2005-05-02 20:53:03+00:00
The status and physics program of the Spectrometer with Vertex Detector,http://arxiv.org/abs/hep-ex/0510073v1,"['P. Ermolov', 'A. Kiriakov', 'A. Kubarovsky', 'V. Nikitin', 'V. Popov', 'I. Rufanov', 'L. Tikhonova', 'V. Volkov', 'A. Vorobiev']","  The brief history, physics program and the current status of the SVD-2
detector is presented. The future plans for the experiments with upgraded
SVD-2M setup is discussed.
",None,2005-10-27 11:12:58+00:00
Searches for BSM (non-SUSY) Physics at the Tevatron,http://arxiv.org/abs/hep-ex/0511011v1,['Heather K. Gerberich'],"  Results of searches at the Tevatron for physics (non-SUSY and non-Higgs)
beyond the Standard Model using 200/pb to 480/pb of data are discussed.
Searches at DO and CDF for Z', Lepton-Quark compositeness, Randall-Sundrum
Gravitons, Large Extra Dimensions, W', Leptoquarks and Excited Electrons are
presented here.
",None,2005-11-03 19:24:13+00:00
Kaons: Review and Outlook,http://arxiv.org/abs/hep-ex/0605120v1,['Augusto Ceccucci'],"  This article presents a review of recent results and an outlook of kaon
physics. After enjoying a renaissance, the discipline is now becoming and
endangered species. Action will be needed to keep kaon physics at the heart of
future FPCP meetings.
",None,2006-05-30 17:56:30+00:00
Comments on Lattice Calculations of Proton Spin Components,http://arxiv.org/abs/hep-lat/9510046v1,['Keh-Fei Liu'],"  Comments on the recent lattice QCD calculations of the flavor-singlet axial
coupling constant $g_A^0$ and individual quark and gluon spin contributions to
the proton spin is given. I point out the physics learned from these
calculations as well as some of the lessons and pitfalls.
",None,1995-10-25 18:55:06+00:00
Heavy Quark Phenomenology from Lattice QCD,http://arxiv.org/abs/hep-lat/0011075v1,['Damir Becirevic'],"  Recent results relevant for the B-physics phenomenology, obtained from
lattice QCD simulations by the APE Collaboration, are reviewed. This includes
the B0-B0bar mixing amplitude, B-> pi semileptonic decay and the relative width
difference of B0_s mesons, $(\Delta \Gamma/\Gamma)_{B_s}$.
",Nucl.Phys.Proc.Suppl. 94 (2001) 337-341,2000-11-21 13:33:26+00:00
Geometric Origin of Staggered Fermion: Direct Product K-Cycle,http://arxiv.org/abs/hep-lat/0105017v1,"['Jian Dai', 'Xing-Chang Song']","  Staggered formalism of lattice fermion can be cast into a form of direct
product K-cycle in noncommutative geometry. The correspondence between this
staggered K-cycle and a canonically defined K-cycle for finitely generated
abelian group where lattice appears as a special case is proved.
",Commun.Theor.Phys. 39 (2003) 519-520,2001-05-18 03:28:13+00:00
The Confinement Problem in Lattice Gauge Theory,http://arxiv.org/abs/hep-lat/0301023v2,['J. Greensite'],"  I review investigations of the quark confinement mechanism that have been
carried out in the framework of SU(N) lattice gauge theory. The special role of
Z(N) center symmetry is emphasized.
",Prog.Part.Nucl.Phys. 51 (2003) 1,2003-01-22 21:56:23+00:00
The Physical Hilbert Space of SU(2) Lattice Gauge Theory,http://arxiv.org/abs/hep-lat/0405008v1,['Manu Mathur'],"  We solve the Gauss law of SU(2) lattice gauge theory using the harmonic
oscillator prepotential formulation. We construct a generating function of a
manifestly gauge invariant and orthonormal basis in the physical Hilbert space
of (d+1) dimensional SU(2) lattice gauge theory. The resulting orthonormal
physical states are given in closed form. The generalization to SU(N) gauge
group is discussed.
",None,2004-05-11 15:14:13+00:00
Status of Lattice Flavor Physics,http://arxiv.org/abs/hep-lat/0410008v2,['Matthew Wingate'],"  This talk reviews recent lattice QCD calculations relevant for quark flavor
physics. Since lattice results must be accurate and precise to play a
definitive role in phenomenology, the focus is on unquenched results of
quantities which can be calculated most reliably.
",None,2004-10-05 20:54:33+00:00
Nuclear Physics and Lattice QCD,http://arxiv.org/abs/hep-lat/0509048v1,['Martin J. Savage'],"  Lattice QCD is progressing toward being able to impact our understanding of
nuclei and nuclear processes. I discuss areas of nuclear physics that are
becoming possible to explore with lattice QCD, the techniques that are
currently available and the status of numerical explorations.
",PoS LAT2005 (2005) 020,2005-09-15 22:45:41+00:00
Electroweak Discussion Section Summary,http://arxiv.org/abs/hep-ph/9310255v1,['C. S. Kim'],"  I summarize our work of electroweak discussion section held at the 14th
International Workshop on Weak Interactions and Neutrinos. We discussed about a
few physics topics related to electroweak interactions, including $B$ and $K$
physics and weak flavor physics.
",None,1993-10-09 03:30:42+00:00
Progress in SSC Physics: Report of the Higgs Working Group,http://arxiv.org/abs/hep-ph/9310333v1,"['J. F. Gunion', 'S. Geer']","  I review new developments in Higgs physics and electroweak symmetry breaking
that have resulted from the Madison--Argonne workshops on SSC physics.
",None,1993-10-21 17:56:00+00:00
Tau Physics Prospects at the Tau-Charm Factory and at Other Machines,http://arxiv.org/abs/hep-ph/9312273v1,['A. Pich'],"  The prospects for tau physics at future high-luminosity facilities are
briefly discussed. Although important (and often complementary) contributions
will be made from other machines, the unique experimental environment near
threshold makes the Tau-Charm Factory the best experimental tool for $\tau$
physics.
",None,1993-12-13 23:29:12+00:00
Gauge fixing by unitary transformations in QCD,http://arxiv.org/abs/hep-ph/9408288v1,['Dieter Stoll'],"  The unitary gauge fixing technique is applied to the QCD hamiltonian
formulated in terms of angular variables. It is demonstrated that in this
formulation projections on the physical Hilbert space are unnecessary to
separate physical and unphysical degrees of freedom. Therefore the application
of the unitary gauge fixing technique can be extended to the operator level.
",Phys.Lett. B336 (1994) 518-523,1994-08-15 18:40:57+00:00
Physics Beyond the Standard Model: Prospects and Perspectives,http://arxiv.org/abs/hep-ph/9409233v1,['R. Sekhar Chivukula'],"  In this talk I discuss the effects of physics beyond the standard model on
the process $Z \to b\bar{b}$. I argue that, because the top-quark is heavy,
this process is susceptible to large corrections from new physics.
",None,1994-09-06 17:13:39+00:00
Physics at DAPHNE,http://arxiv.org/abs/hep-ph/9409425v1,['Paula J. Franzini'],"  Proceedings of invited lecture at the Zuoz summer school on hadronic aspects
of collider physics, August 23-31, 1994, Zuoz, Switzerland. Describes the PHI
factory DAPHNE being built at Frascati, Italy, and the physics that can be done
there, with emphasis on its potential for studying CP violation.
",None,1994-09-27 16:09:25+00:00
"New physics motivated by the low energy approach to electric charge
  quantization",http://arxiv.org/abs/hep-ph/9410277v1,"['H. Lew', 'R. R. Volkas']","  The low-energy approach to electric charge quantization predicts physics
beyond the minimal standard model. A model-independent approach via effective
Lagrangians is used examine the possible new physics, which may manifest itself
indirectly through family-lepton--number violating rare decays.
",Phys.Rev. D51 (1995) 3849-3854,1994-10-13 13:12:00+00:00
"Single Spin Asymmetries in Proton-Proton and Proton-Neutron Scattering
  at 820 GeV",http://arxiv.org/abs/hep-ph/9501270v1,['Wolf-Dieter Nowak'],"  The physics case is summarised for the investigation of high energy spin
phenomena by placing an internal polarised target into HERA's unpolarised
proton beam. The luminosity and experimental sensitivity are discussed.
Estimating the physics reach of single spin asymmetries in different final
states reveals a considerable physics potential in testing the spin sector of
perturbative QCD.
",None,1995-01-11 14:18:51+00:00
"SO(10): a possible Scenario for new Physics in the Neutrino Sector and
  Baryogenesis",http://arxiv.org/abs/hep-ph/9503452v1,"['G. Amelino-Camelia', 'O. Pisanti', 'L. Rosa']","  The implications on neutrino physics and on the dynamical generation of the
baryonic asymmetry of a class of $SO(10)$ non-supersymmetric models are
discussed.
",Nucl.Phys.Proc.Suppl. 43 (1995) 86-89,1995-03-27 22:23:28+00:00
Virtual Effects of Physics Beyond the Standard Model,http://arxiv.org/abs/hep-ph/9505228v1,['J. L. Hewett'],"  We examine the indirect effects of new physics on a variety of processes in
the $B$ system, such as the $Z\to b\bar b$ vertex, the decays $B\to X_s \gamma$
and $B\to X_s\ell^+\ell^-$, and CP violation. {Presented at the 4th
International Conference on Physics Beyond the Standard Model, Lake Tahoe, CA,
December 13-18, 1994}
",None,1995-05-04 00:00:09+00:00
PYTHIA 5.7 and JETSET 7.4 Physics and Manual,http://arxiv.org/abs/hep-ph/9508391v1,['Torbjorn Sjostrand'],"  This is the latest edition of the physics description and manual of the
PYTHIA and JETSET programs for event generation in High Energy Physics.
",None,1995-08-29 13:11:07+00:00
Physics at an $e^-e^-$ Facility,http://arxiv.org/abs/hep-ph/9512201v1,['Frank Cuypers'],"  We review some of the reactions which can be studied in the $e^-e^-$ mode of
a linear collider and may reveal aspects of physics beyond the realm of the
standard model. The complementarity to $e^+e^-$ scattering is stressed.
",None,1995-12-01 08:42:03+00:00
Soft Photoproduction Physics,http://arxiv.org/abs/hep-ph/9601210v1,['Torbjorn Sjostrand'],"  Several topics of interest in soft photoproduction physics are discussed.
These include jet universality issues (particle flavour composition), the
subdivision into event classes, the buildup of the total photoproduction cross
section and the effects of multiple interactions.
","J.Phys.G22:709-716,1996",1996-01-04 14:58:42+00:00
"Unification and Model Building, Astroparticle Physics and Neutrinos",http://arxiv.org/abs/hep-ph/9604285v1,"['Amitava Raychaudhuri', 'Probir Roy']","  This report summarises the work done during the Workshop on High Energy
Physics Phenomenology 4 (S.N.Bose National Centre for Basic Sciences, Calcutta,
India, Jan 2-14,1996) in Working Groups IV (Unification and Model Building) and
V (Astroparticle Physics and Neutrinos).
",None,1996-04-11 10:39:23+00:00
Physics Cahiers No. 1,http://arxiv.org/abs/hep-ph/9605374v1,['S. Bellucci'],"  We begin herewith the editing of physics notes taken in the course of Journal
Club seminars at INFN-LNF in 1996. The activity consists of informal talks
about work in progress and/or review of (more or less) recent physics results
of interest to our laboratory. In the section titles the name of the speakers
appear, together with the topics discussed in the seminars. We plan to publish
these notes twice a year.
",None,1996-05-22 14:53:06+00:00
Chiral Perturbation Theory for DA$Φ$NE Physics,http://arxiv.org/abs/hep-ph/9607304v1,['J. Bijnens'],"  This talk is an overview of Chiral Perturbation Theory for Kaon physics as
far as not covered by other speakers. It includes a short introduction to the
strengths and weaknesses of Chiral Perturbation Theory and its applications to
semileptonic Kaon decays and $K\to\pi\pi(\pi)$.
",None,1996-07-12 15:13:02+00:00
Prospects for Quarkonium Physics at HERA,http://arxiv.org/abs/hep-ph/9609500v1,"['Matteo Cacciari', 'Michael Krämer']","  We work out and review prospects for future quarkonium physics at HERA. We
focus on the impact of color-octet contributions and discuss how measurements
at HERA can be used to test the picture of quarkonium production as developed
in the context of the NRQCD factorization approach.
",None,1996-09-27 06:33:59+00:00
Summary of the Very Large Hadron Collider Physics and Detector Subgroup,http://arxiv.org/abs/hep-ph/9701402v1,"['D. Denisov', 'S. Keller']","  We summarize the activity of the Very Large Hadron Collider Physics and
Detector subgroup during Snowmass 96.
","ECONFC960625:ACC040,1996",1997-01-28 21:40:57+00:00
A Simplified Summary of Supersymmetry,http://arxiv.org/abs/hep-ph/9704349v1,['J. F. Gunion'],"  I give an overview of the motivations for and theory/phenomenology of
supersymmetry.
",None,1997-04-18 03:40:43+00:00
Spin Physics,http://arxiv.org/abs/hep-ph/9706351v1,['T. Gehrmann'],"  A summary of new experimental results and recent theoretical developments
presented in the ``Spin Physics'' working group is given.
",None,1997-06-13 14:38:38+00:00
Determination of Vtd/Vts within the Standard Model,http://arxiv.org/abs/hep-ph/9706380v1,"['C. S. Kim', 'T. Morozumi', 'A. I. Sanda']","  We propose a new method to extract the value of |Vtd/Vts| from the ratio of
the decay distributions dBr/ds[B->Xd l^+ l^-}] and dBr/ds[B Xs l^+ l^-].
",None,1997-06-17 07:59:04+00:00
"Residual New Physics Effects in the Heavy Quark Sector, Tests at LEP2
  and Higher Energies",http://arxiv.org/abs/hep-ph/9707261v1,['F. M. Renard'],"  We discuss the sensitivity of the processes $e^+e^-\to t\bar t$ and
$e^+e^-\to b\bar b$ to special sets of operators describing residual New
Physics effects. Experimental data in this sector together with those expected
in the bosonic sector should allow to constrain possible New Physics schemes
with effective scales in the 10 TeV range.
",None,1997-07-07 08:29:59+00:00
Muon Colliders: The Machine and The Physics,http://arxiv.org/abs/hep-ph/9707379v2,['J. F. Gunion'],"  A review of muon colliders is presented. Basic features of the accelerator
and detector are outlined, and the very exciting physics prospects are
reviewed.
",AIP Conf.Proc. 415 (1997) 234-251,1997-07-17 22:28:19+00:00
"Non-universal Soft SUSY Breaking Effects on Dark Matter and on Physics
  at Colliders",http://arxiv.org/abs/hep-ph/9710477v1,"['Pran Nath', 'R. Arnowitt']","  Implications of the effects of non-universalities of the soft SUSY breaking
parameters on dark matter and on physics at colliders is discussed.
",None,1997-10-26 19:24:11+00:00
Top Quark Physics: Overview,http://arxiv.org/abs/hep-ph/9712512v1,['Stephen Parke'],"  In this presentation I will primarily focus on top quark physics but I will
include a discussion of the W-boson mass and the possibility of discovering a
light Higgs boson via associated production at the Tevatron.
",None,1997-12-23 18:18:05+00:00
"Dark Matter: Motivation, Candidates and Searches",http://arxiv.org/abs/hep-ph/9712538v1,['G. G. Raffelt'],"  The physical nature of most of the gravitating mass in the universe is
completely mysterious. The astrophysical evidence for the presence of this dark
matter and astrophysical constraints on its properties will be reviewed. The
most popular dark-matter candidates will be introduced, and current and future
attempts to search for them directly and indirectly will be discussed.
",None,1997-12-29 18:00:16+00:00
Astro-Particle Physics,http://arxiv.org/abs/hep-ph/9712548v1,['G. G. Raffelt'],"  Recent developments of those areas of astro-particle physics are discussed
that were represented at the HEP97 conference. In particular, the current
status of direct and indirect dark-matter searches and of TeV neutrino and
gamma-ray astronomy will be reviewed.
",None,1997-12-31 09:04:50+00:00
Physics at a Muon Collider,http://arxiv.org/abs/hep-ph/9802258v1,['J. F. Gunion'],"  I discuss the exciting prospects for exploring a wide range of new physics at
a low-energy muon collider.
",AIP Conf.Proc. 435 (1998) 37-57,1998-02-05 21:47:31+00:00
Higgs and Technicolor Goldstone Bosons at a Muon Collider,http://arxiv.org/abs/hep-ph/9804358v1,['J. F. Gunion'],"  I discuss the exciting prospects for Higgs and technicolor Goldstone boson
physics at a muon collider.
",None,1998-04-21 22:29:48+00:00
