title,id,authors,abstract,journal,published
The Tau Lepton and the Search for New Elementary Particle Physics,http://arxiv.org/abs/hep-ph/9812400v1,['M. L. Perl'],"  This Fifth International WEIN Symposium is devoted to physics beyond the
standard model. This talk is about tau lepton physics, but I begin with the
question: do we know how to find new physics in the world of elementary
particles? This question is interwoven with the various tau physics topics.
These topics are: searching for unexpected tau decay modes; searching for
additional tau decay mechanisms; radiative tau decays; tau decay modes of the
W, B, and D; decay of the Z^0 to tau pairs; searching for CP violation in tau
decay; the tau neutrino, dreams and odd ideas in tau physics; and tau research
facilities in the next decades.
",None,1998-12-16 22:50:39+00:00
Supersymmetry Structure and Phenomena,http://arxiv.org/abs/hep-ph/0108236v1,['Nir Polonsky'],"  A fairly non-technical introduction to and survey of supersymmetry
phenomenology with pedagogical emphasis, including exercises. Suitable for both
theorists and experimentalists. The manuscript appeared as a Springer-Verlag
monograph in physics. The body of the manuscript is provided here with the
publisher`s permission.
",Lect.Notes Phys. M68 (2001) 1-169,2001-08-29 01:48:12+00:00
"Physics at a gamma gamma, e gamma and e-e- Option for a Linear Collider",http://arxiv.org/abs/hep-ph/0311138v1,['A. De Roeck'],"  This report presents a review of the studies made in the working group on
gamma gamma and e gamma physics"" of the ECFA/DESY workshop on linear collider
physics. It reports on several new physics studies, in particular s-channel
Higgs production. A summary of R&D activities for the interaction region is
presented. The merits of e-e- collisions are briefly recalled.
",None,2003-11-11 11:35:56+00:00
Lattice QCD and Flavor Physics,http://arxiv.org/abs/hep-ph/0409099v1,['Matthew Wingate'],"  Now that lattice QCD simulations are able to include effects of light sea
quarks, the prospects are good for constraining quark flavor phenomenology.
This review talk for particle physics experimentalists begins with an
introduction intended to describe broadly the steps of lattice Monte Carlo
simulations. The remainder of the talk is a brief survey of recent and ongoing
calculations relevant for quark flavor physics.
",None,2004-09-08 19:58:48+00:00
The Cosmology - Particle Physics Connection,http://arxiv.org/abs/hep-ph/0605284v1,['Mark Trodden'],"  Modern cosmology poses deep and unavoidable questions for fundamental
physics. In this plenary talk, delivered in slightly different forms at the
{\it Particles and Nuclei International Conference} (PANIC05) in Santa Fe, in
October 2005, and at the {\it CMB and Physics of the Early Universe
International Conference}, on the island of Ischia, Italy, in April 2006, I
discuss the broad connections between cosmology and particle physics, focusing
on physics at the TeV scale, accessible at the next and future generations of
colliders
",None,2006-05-26 13:07:09+00:00
Cosmology and New Physics,http://arxiv.org/abs/hep-ph/0606230v1,['A. D. Dolgov'],"  A comparison of the standard models in particle physics and in cosmology
demonstrates that they are not compatible, though both are well established.
Basics of modern cosmology are briefly reviewed. It is argued that the
measurements of the main cosmological parameters are achieved through many
independent physical phenomena and this minimizes possible interpretation
errors. It is shown that astronomy demands new physics beyond the frameworks of
the (minimal) standard model in particle physics. More revolutionary
modifications of the basic principles of the theory are also discussed.
","Phys.Atom.Nucl.71:651-670,2008",2006-06-21 14:49:25+00:00
Physics at LHC,http://arxiv.org/abs/hep-ph/0611237v1,['John Ellis'],"  The prospects for physics at the LHC are discussed, starting with the
foretaste, preparation (and perhaps scoop) provided by the Tevatron, in
particular, and then continuing through the successive phases of LHC operation.
These include the start-up phase, the early physics runs, the possible search
for new physics in double diffraction, the continuation to nominal LHC running,
and the possible upgrade of the LHC luminosity. Emphasis is placed on the
prospects for Higgs physics and the search for supersymmetry. The progress and
discoveries of the LHC will set the time-scale and agenda for the major future
accelerator projects that will follow it.
","Acta Phys.Polon.B38:1071,2007",2006-11-17 17:09:06+00:00
Effects of Dirac's Negative Energy Sea on Quantum Numbers,http://arxiv.org/abs/hep-th/9903255v1,['R. Jackiw'],"  One route towards understanding both fractional charges and chiral anomalies
delves into Dirac's negative energy sea. Usually we think of Dirac's negative
energy sea as an unphysical construct, invented to render quantum field theory
physically acceptable by hiding the negative energy solutions. I suggest that
in fact physical consequences can be drawn from Dirac's construction.
",None,1999-03-30 17:00:14+00:00
Dynamics and causality constraints,http://arxiv.org/abs/hep-th/0006214v3,['Manoelito M de Souza'],"  The physical meaning and the geometrical interpretation of causality
implementation in classical field theories are discussed. Local causality are
kinematical constraints dynamically implemented via solutions of the field
equations, but in a limit of zero-distance from the field sources part of these
constraints carries a dynamical content that explains old problems of classical
electrodynamics away with deep implications to the nature of physical
interactions.
",Braz.J.Phys. 32 (2002) 609-616,2000-06-27 20:47:47+00:00
Principles of a Unified Theory of Spacetime and Physical Interactions,http://arxiv.org/abs/hep-th/0111021v1,['Yu. S. Vladimirov'],"  Principles of a new approach (binary geometrophysics) are presented to
construct the unified theory of spacetime and the familiar kinds of physical
interactions. Physically, the approach is a modified S-matrix theory involving
ideas of the multidimensional geometric models of physical interactions of
Kaluza-Klein's type as well as Fokker-Feynman's action-at-a-distance theory.
Mathematically, this is a peculiar binary geometry being described in algebraic
terms. In the present approach the binary geometry volume is a prototype of
three related notions: the S-matrix, the physical action (Lagrangian) of both
strong and electroweak interactions, and the multidimensional metric. A
transition from microworld geometrophysics to the conventional physical theory
in classical spacetime are characterized.
",None,2001-11-02 14:21:14+00:00
Lectures on Fuzzy and Fuzzy SUSY Physics,http://arxiv.org/abs/hep-th/0511114v2,"['A. P. Balachandran', 'S. Kurkcuoglu', 'S. Vaidya']","  This is a preliminary version, comments and inputs are welcome.
  Contents:
  1. Introduction.
  2. Fuzzy Spaces.
  3. Star Products.
  4. Scalar Fields on the Fuzzy Sphere.
  5. Instantons, Monopoles and Projective Modules.
  6. Fuzzy Nonlinear Sigma Models.
  7. Fuzzy Gauge Theories.
  8. The Dirac Operator and Axial Anomaly.
  9. Fuzzy Supersymmetry.
  10.Fuzzy Spaces as Hopf Algebras.
",None,2005-11-09 20:51:22+00:00
Making sense of Physics in the first year of study,http://arxiv.org/abs/physics/9911071v1,"['Shirley Booth', 'Ake Ingerman']","  We address the question ""How do students make sense of Physics from the point
of view of constituting physics knowledge?"". A phenomenographic study is
described as a result of which we present six qualitatively different ways in
which students experience the first year of Physics. The variation is analysed
in terms of the structure of experience, the nature of knowlege and an ethical
aspect related to the identification of authority. Three of these ways of
experiencing the first year are considered to be unproductive in terms of
making sense of physics, while the other three support, to an increasing
degree, the formation of a well-grounded physics knowledge object. Implications
for practice are considered.
","Learning and Instruction, Volume 12, Pages 493-507 (2002)",1999-11-26 16:47:19+00:00
"Fiber Bundle Gauge Theories and ""Field's Dilemma""",http://arxiv.org/abs/physics/0005051v1,"['Yair Guttmann', 'Holger Lyre']","  We propose a distinction between the physical and the mathematical parts of
gauge field theories. The main problem we face is to uphold a strong and
meaningful criterion of what is physical. We like to call it ""Field's dilemma"",
referring to Hartry Field's nominalist proposal which we consider to be
inadaequate. The resolution to the dilemma, we believe, is implicitly provided
by the so-called fiber bundle formalism. We shall demonstrate, in detail, that
the bundle structure underlying modern quantum and gravitational gauge field
theories allows for a genuine distinction between the physically significant
and the merely mathematical parts of these theories.
",None,2000-05-19 20:31:45+00:00
On Some General Physical Aspects of the Real Physical Space and Time,http://arxiv.org/abs/physics/0101084v1,"['A. M. Gevorkian', 'R. A. Gevorkian']","  The paper discusses some aspects of real physical space and time: structure
of electrodynamics; structure of gravitational-inert theory in the real world;
formation of the real matter; Mach's principle and the radiational cosmic mass;
spread and transmission of information in the space of the real world;
fundamental and main physical constants, protostar or 3+1-dimensional matter;
and some philosophical and general physical approaches to solutions of physical
problems.
",None,2001-01-24 12:17:56+00:00
"The Vocabulary of Introductory Physics and its Implications for Learning
  Physics",http://arxiv.org/abs/physics/0207066v2,"['S. Itza-Ortiz', 'N. S. Rebello', 'D. Zollman', 'M. Rodriguez-Achach']","  We investigate studnets' use of words used in everyday language as well as in
physics. We find students are more likely to identify and explain the meaning
of the word as it is used in physics when they have become familiar with the
associated physical variables.
","Phys. Teach. 41(6), 2003 pp 330-336",2002-07-16 19:13:56+00:00
Fast Calculations in Nonlinear Collective Models of Beam/Plasma Physics,http://arxiv.org/abs/physics/0212115v1,"['Antonina N. Fedorova', 'Michael G. Zeitlin']","  We consider an application of variational-wavelet approach to nonlinear
collective models of beam/plasma physics: Vlasov/Boltzmann-like reduction from
general BBGKY hierachy. We obtain fast convergent multiresolution
representations for solutions which allow to consider polynomial and rational
type of nonlinearities. The solutions are represented via the multiscale
decomposition in nonlinear high-localized eigenmodes (waveletons).
",Nucl.Instrum.Meth. A502 (2003) 660-662,2002-12-31 20:05:48+00:00
Physics Education Research: Or it's so hard to find good help these days,http://arxiv.org/abs/physics/0405006v1,['Sanjoy Mahajan'],"  Physics education research (PER) aims to improve how students solve problems.
But whose problems are we teaching students to solve? Physics has grown up as a
child of war, and PER stems from the cognitive revolution in psychology, which
arose from military needs and funding. Physics, PER, and state power are
allies. By improving physics teaching, we arm the state against ourselves and
move farther from a peaceful and humane world.
",None,2004-05-03 14:56:43+00:00
Majorana and the path-integral approach to Quantum Mechanics,http://arxiv.org/abs/physics/0603140v1,['S. Esposito'],"  We give, for the first time, the English translation of a manuscript by
Ettore Majorana, which probably corresponds to the text for a seminar delivered
at the University of Naples in 1938, where he lectured on Theoretical Physics.
Some passages reveal a physical interpretation of the Quantum Mechanics which
anticipates of several years the Feynman approach in terms of path integrals,
independently of the underlying mathematical formulation.
",None,2006-03-17 11:32:07+00:00
Four variations on Theoretical Physics by Ettore Majorana,http://arxiv.org/abs/physics/0604064v1,['S. Esposito'],"  An account is given of some topical unpublished work by Ettore Majorana,
revealing his very deep intuitions and skilfulness in Theoretical Physics. The
relevance of the quite unknown results obtained by him is pointed out as well.
",None,2006-04-07 16:33:02+00:00
Hempel's dilemma and the physics of computation,http://arxiv.org/abs/physics/0702072v1,['C. W. J. Beenakker'],"  Carl Gustav Hempel (1905-1997) formulated the dilemma that carries his name
in an attempt to determine the boundaries of physics. Where does physics go
over into metaphysics? The purpose of this contribution is to indicate how a
recently developed field of research, the physics of computation, might offer a
new answer to that old question: The boundary between physics and metaphysics
is the boundary between what can and what cannot be computed in the age of the
universe.
","in: Knowledge in Ferment: Dilemmas in Science, Scholarship and
  Society (Leiden University Press, 2007)",2007-02-08 22:13:04+00:00
Giulio Racah and Theoretical Physics in Jerusalem,http://arxiv.org/abs/physics/0703032v1,['Nissan Zeldes'],"  Giulio Racah's name is known world wide in physics due to the mathematical
methods he developed that are based on tensor operators and continuous groups.
These methods revolutionized spectroscopy, and they are currently essential
research tools in atomic, nuclear and elementary particle physics. He himself
applied them to modernizing theoretical atomic spectroscopy. Racah laid the
foundations of theoretical physics in Israel. He educated several generations
of Israeli physicists, and put Israel on the world map of physics.
",None,2007-03-03 18:24:02+00:00
Emerging technologies in physics education,http://arxiv.org/abs/physics/0703224v1,['Zosia A. C. Krusberg'],"  Three emerging technologies in physics education are evaluated from the
interdisciplinary perspective of cognitive science and physics education
research. The technologies - Physlet Physics, the Andes Intelligent Tutoring
System (ITS), and Microcomputer-Based Laboratory (MBL) Tools - are assessed
particularly in terms of their potential at promoting conceptual change,
developing expert-like problem-solving skills, and achieving the goals of the
traditional physics laboratory. Pedagogical methods to maximize the potential
of each educational technology are suggested.
",None,2007-03-24 07:18:40+00:00
"Symmetries in nuclear, atomic and molecular spectroscopy",http://arxiv.org/abs/quant-ph/9711007v1,['Maurice Kibler'],"  This paper addresses the three following questions. (i) How the structures of
group and of chain of groups enter nuclear, atomic and molecular spectroscopy?
(ii) How these structures can be exploited, in a quantum- mechanical framework,
in the problems of state labelling and (external) symmetry breaking? (iii) How
it is possible to associate a Wigner-Racah algebra to a group or a chain of
groups for making easier the calculation of quantum-mechanical matrix elements?
Numerous examples illustrate the philosophy of qualitative and quantitative
applications to spectroscopy.
",None,1997-11-08 11:56:39+00:00
Quantum mechanics as a complete physical theory,http://arxiv.org/abs/quant-ph/0211053v1,['D. A. Slavnov'],"  We show that the principles of a ''complete physical theory'' and the
conclusions of the standard quantum mechanics do not irreconcilably contradict
each other as is commonly believed. In the algebraic approach, we formulate
axioms that allow constructing a renewed mathematical scheme of quantum
mechanics. This scheme involves the standard mathematical formalism of quantum
mechanics. Simultaneously, it contains a mathematical object that adequately
describes a single experiment. We give an example of the application of the
proposed scheme.
",Theor.Math.Phys. 132 (2002) 1262-1274,2002-11-10 12:30:37+00:00
Probabilities as Measures of Information,http://arxiv.org/abs/quant-ph/0310073v2,['Francis G. Perey'],"  We analyze the notion that physical theories are quantitative and testable by
observations in experiments. This leads us to propose a new, Bayesian,
interpretation of probabilities in physics that unifies their current use in
classical physical theories, experimental physics and quantum mechanics.
Probabilities are the result of quantifying the domain of possibilities that
results when we interpret observations within the framework of a physical
theory. They could also be said to be measures of information used to make
predictions based upon a physical theory.
",None,2003-10-12 03:23:52+00:00
A Critique of PT-Symmetric Quantum Mechanics,http://arxiv.org/abs/quant-ph/0310164v1,['Ali Mostafazadeh'],"  We study the physical content of the PT-symmetric complex extension of
quantum mechanics as proposed in Bender et al, Phys. Rev. Lett. 80, 5243 (1998)
and 89, 270401 (2002), and show that as a fundamental probabilistic physical
theory it is neither an alternative to nor an extension of ordinary quantum
mechanics. We demonstrate that the definition of a physical observable given in
the above papers is inconsistent with the dynamical aspect of the theory and
offer a consistent notion of an observable.
",None,2003-10-28 10:19:36+00:00
Quantum Logic and Non-Commutative Geometry,http://arxiv.org/abs/quant-ph/0405159v1,"['P. A. Marchetti', 'R. Rubele']","  We propose a general scheme for the ""logic"" of elementary propositions of
physical systems, encompassing both classical and quantum cases, in the
framework given by Non Commutative Geometry. It involves Baire*-algebras, the
non-commutative version of measurable functions, arising as envelope of the
C*-algebras identifying the topology of the (non-commutative) phase space. We
outline some consequences of this proposal in different physical systems. This
approach in particular avoids some problematic features appearing in the
definition of the state of ""initial conditions"" in the standard W*-algebraic
approach to classical systems.
",Int.J.Theor.Phys. 46 (2007) 49-62,2004-05-26 15:55:23+00:00
"Phase information revealed by interferences in the ionization of
  rotational wave packets",http://arxiv.org/abs/quant-ph/0606068v3,"['Eric Charron', 'Maurice Raoult']","  Time-resolved photoelectron spectra are proposed for the measurement of
classical information recorded in the quantum phases of a molecular rotational
wave packet. Taking Li2 as a prototypical system, we show that an interference
arises from the electron-nuclei entanglement induced by the molecular
anisotropy. This phenomenon is used to transfer the information that was stored
initially in the nuclear rotational degree of freedom into the electronic
degree of freedom.
","Physical Review A / Physical Review A (General Physics); Phys Rev
  A Gen Phys; Physical Review A (Atomic Molecular and Optical Physics) 74, 3
  (15/09/2006) 033407",2006-06-08 10:00:28+00:00
Quantum phase gate and controlled entanglement with polar molecules,http://arxiv.org/abs/quant-ph/0608182v2,"['Eric Charron', 'Pérola Milman', 'Arne Keller', 'Osman Atabek']","  We propose an alternative scenario for the generation of entanglement between
rotational quantum states of two polar molecules. This entanglement arises from
dipole-dipole interaction, and is controlled by a sequence of laser pulses
simultaneously exciting both molecules. We study the efficiency of the process,
and discuss possible experimental implementations with cold molecules trapped
in optical lattices or in solid matrices. Finally, various entanglement
detection procedures are presented, and their suitability for these two
physical situations is analyzed.
","Physical Review A / Physical Review A (General Physics); Phys Rev
  A Gen Phys; Physical Review A (Atomic Molecular and Optical Physics) 75, 3
  (26/03/2007) 033414",2006-08-23 18:15:27+00:00
Physics Beyond the Standard Model and Dark Matter,http://arxiv.org/abs/0704.2276v1,['Hitoshi Murayama'],"  In this lecture note, I discuss why many of us are expecting rich physics at
the TeV scale, drawing analogies from the history of physics in the last
century. Then I review some of the possible candidates of new physics at this
energy scale. I also discuss why we believe much of the matter in the universe
is not atoms (baryons) or compact astronomical objects, and hence requires
physics beyond the standard model. Finally I discuss some of the candidates for
the non-baryonic dark matter.
",None,2007-04-18 07:25:18+00:00
Searches for Physics Beyond the Standard Model at Colliders,http://arxiv.org/abs/0711.0529v1,['Beate Heinemann'],"  All experimental measurements of particle physics today are beautifully
described by the Standard Model. However, there are good reasons to believe
that new physics may be just around the corner at the TeV energy scale. This
energy range is currently probed by the Tevatron and HERA accelerators and
selected results of searches for physics beyond the Standard Model are
presented here. No signals for new physics have been found and limits are
placed on the allowed parameter space for a variety of different particles.
","J.Phys.Conf.Ser.110:012002,2008",2007-11-04 17:17:35+00:00
Electroweak Physics at the ILC,http://arxiv.org/abs/0711.3003v1,['Georg Weiglein'],"  Some aspects of electroweak physics at the International Linear Collider
(ILC) are reviewed. The importance of precision measurements in the Higgs
sector and in top-quark physics is emphasized, and the physics potential of the
GigaZ option of the ILC is discussed. It is shown in particular that even in a
scenario where the states of new physics are so heavy that they would be
outside of the reach of the LHC and the first phase of the ILC, the GigaZ
precision on the effective weak mixing angle may nevertheless allow the
detection of quantum effects of new physics.
","J.Phys.Conf.Ser.110:042033,2008",2007-11-19 19:24:02+00:00
Thermodynamics of quasianti-Hermitian quaternionic systems,http://arxiv.org/abs/0804.3153v4,['S. A. Alavi'],"  Thermodynamics of quasianti-Hermitian quaternionic systems with constant
number of particles in equilibrium is studied. A toy model is introduced and
the physically relevant quantities are derived. The energy fluctuation which
shows that for large N the relative r.m.s fluctuation in the values of E is
quite negligible is derived. The negative temperature for such systems is also
studied. Finally a physical example is discussed and physical explanations in
the context of quantum physics are given.
",Universal Journal of Physics and Application 1(2013)26-31,2008-04-19 15:06:08+00:00
Physically-Relativized Church-Turing Hypotheses,http://arxiv.org/abs/0805.1292v1,['Martin Ziegler'],"  We turn `the' Church-Turing Hypothesis from an ambiguous source of
sensational speculations into a (collection of) sound and well-defined
scientific problem(s):
  Examining recent controversies, and causes for misunderstanding, concerning
the state of the Church-Turing Hypothesis (CTH), suggests to study the CTH
relative to an arbitrary but specific physical theory--rather than vaguely
referring to ``nature'' in general. To this end we combine (and compare)
physical structuralism with (models of computation in) complexity theory. The
benefit of this formal framework is illustrated by reporting on some previous,
and giving one new, example result(s) of computability and complexity in
computational physics.
","pp.1431-1447 in Applied Mathematics and Computation vol.215:4
  (2009)",2008-05-09 07:27:37+00:00
Top Quark Physics at the LHC,http://arxiv.org/abs/0808.0031v3,['Akira Shibata'],"  An overview of the prospects of top quark physics at the LHC is presented.
The ATLAS and the CMS detectors are about to produce a large amount of data
with high top quark contents from the LHC proton-proton collisions. A wide
variet y of physics analyses is planned in both experiments, and a number of
useful insights have already been obtained regarding their detector performance
and physics potential. This summary is based on the talk presented at the
Hadron C ollider Physics Symposium 2008, Galena, Illinois, May 27-31, 2008.
",None,2008-07-31 22:47:41+00:00
"Space-time attributes of physical objects and the laws of space-time
  physics",http://arxiv.org/abs/0809.4121v1,['J. H. Field'],"  Physical time intervals are attributes of single physical object whereas
physical space intervals are a relational attribute of two physical objects.
Some consequences of the breaking of the space-time exchange symmetry inherent
in the Lorentz transformation following from the above distinction are
investigated. In particular, it is shown that the relativity of simultaneity
and length contraction effects which naively follow from space-time symmetry of
the Lorentz transformation do not occur. Seven laws describing the relation
between observations of space intervals, time intervals and velocities in
different reference frames are given. Only two of these laws are respected by
conventional special relativity theory.
",None,2008-09-24 08:14:16+00:00
"From Maxwell Stresses to Photon-like Objects through Curvature
  Geometrisation of Physical Interaction",http://arxiv.org/abs/0902.3924v2,"['Stoil Donev', 'Maria Tashkova']","  This paper aims to review our recent results on exploring the capabilities of
non-quantum field theory as a possible tool for describing single photon-like
objects, considered as massless time-stable spatially finite physical entities
with compatible translational-rotational dynamical structure. The main idea is
to interpret the local physical interaction as available Frobenius curvature.
It consists of five chapters and includes 22 sections and subsections.
",None,2009-02-23 15:06:42+00:00
