title,id,authors,abstract,journal,published
"The first dozen years of the history of ITEP Theoretical Physics
  Laboratory",http://arxiv.org/abs/1208.1386v1,['B. L. Ioffe'],"  The theoretical investigations at ITEP in the years 1945-1958 are reviewed.
There are exposed the most important theoretical results, obtained in the
following branches of physics: 1) the theory of nuclear reactors on thermal
neutrons; 2) the hydrogen bomb project (""Tube"" in USSR and ""Classical Super"" in
USA); 3) radiation theory; ~4) low temperature physics; 5) quantum
electrodynamics and quantum field theories; 6) parity violation in weak
interactions, the theory of $\beta$-decay and other weak processes; 7) strong
interaction and nuclear physics. To the review are added the English
translations of few papers, originally published in Russian, but unknown (or
almost unknown) to Western readers.
",None,2012-08-07 10:04:11+00:00
"The charm physics programme at the LHCb upgrade, and Atlas and CMS
  upgrades",http://arxiv.org/abs/1209.5878v1,['Marco Gersabeck'],"  Charm physics has been established at the LHC based on several high-precision
measurements. The future of charm physics at the LHC experiments is discussed
in detail. The bulk of the charm physics programme will be performed by LHCb
and the LHCb upgrade. In particular, the impact of the LHCb upgrade on mixing
and \CP violation measurements is presented.
",None,2012-09-26 09:09:08+00:00
Publication patterns in HEP computing,http://arxiv.org/abs/1209.5994v1,"['M. G. Pia', 'T. Basaglia', 'Z. W. Bell', 'P. V. Dressendorfer']","  An overview of the evolution of computing-oriented publications in high
energy physics following the start of operation of LHC. Quantitative analyses
are illustrated, which document the production of scholarly papers on
computing-related topics by high energy physics experiments and core tools
projects, and the citations they receive. Several scientometric indicators are
analyzed to characterize the role of computing in high energy physics
literature. Distinctive features of software-oriented and hardware-oriented
scholarly publications are highlighted. Current patterns and trends are
compared to the situation in previous generations' experiments.
",None,2012-09-26 16:34:18+00:00
"Supersymmetry breaking, conserved charges and stability in N=1 Super KdV",http://arxiv.org/abs/1211.1851v1,"['A. Restuccia', 'A. Sotomayor']","  We analyse the non-abelian algebra and the supersymmetric cohomology
associated to the local and non-local conserved charges of N=1 SKdV under
Poisson brackets. We then consider the breaking of the supersymmetry and obtain
an integrable model in terms of Clifford algebra valued fields. We discuss the
remaining conserved charges of the new system and the stability of the
solitonic solutions.
",Journal of Physics: Conference Series 410 (2013) 012073,2012-11-08 13:48:49+00:00
Four-dimensional N=2 Field Theory and Physical Mathematics,http://arxiv.org/abs/1211.2331v1,['Gregory W. Moore'],"  We give a summary of a talk delivered at the 2012 International Congress on
Mathematical Physics. We review d=4, N=2 quantum field theory and some of the
exact statements which can be made about it. We discuss the wall-crossing
phenomenon. An interesting application is a new construction of hyperkahler
metrics on certain manifolds. Then we discuss geometric constructions which
lead to exact results on the BPS spectra for some d=4, N=2 field theories and
on expectation values of -- for example -- Wilson line operators. These new
constructions have interesting relations to a number of other areas of physical
mathematics.
",None,2012-11-10 15:08:56+00:00
On the physics of the $so_q(4)$ hydrogen atom,http://arxiv.org/abs/1211.6578v3,"['P. G. Castro', 'R. Kullock']","  In this work we investigate the $q$-deformation of the $so(4)$ dynamical
symmetry of the hydrogen atom using the theory of the quantum group $su_q(2)$.
We derive the energy spectrum in a physically consistent manner and find a
degeneracy breaking as well as a smaller Hilbert space. We point out that using
the deformed Casimir as was done before leads to inconsistencies in the
physical interpretation of the theory.
",None,2012-11-28 11:30:59+00:00
Unfolding Physics from the Algebraic Classification of Spinor Fields,http://arxiv.org/abs/1212.2406v1,"['J. M. Hoff da Silva', 'Roldão da Rocha']","  After reviewing the Lounesto spinor field classification, according to the
bilinear covariants associated to a spinor field, we call attention and unravel
some prominent features involving unexpected properties about spinor fields
under such classification. In particular, we pithily focus on the new aspects
--- as well as current concrete possibilities. They mainly arise when we deal
with some non-standard spinor fields concerning, in particular, their
applications in physics.
",Physics Letters B 718 (2013) 1519,2012-12-11 12:50:08+00:00
Physics with electroweak penguins at LHCb,http://arxiv.org/abs/1212.6718v1,['Michel De Cian'],"  Flavour changing neutral currents are only allowed via loop diagrams in the
Standard Model (SM). Electroweak penguin processes are therefore sensitive
probes for new physics, as physics beyond the Standard Model can enter via
virtual particles at the same level as SM physics. The LHCb detector at the LHC
with its forward geometry is ideally suited for the analysis of electroweak
penguin processes in $B$ meson decays. All analyses are performed with 1
fb$^{-1}$ of collision data recorded at a centre-of-mass energy of 7 TeV in
2011 and constrain new physics models.
",None,2012-12-30 13:35:13+00:00
Pseudo Hermitian Generalized Dirac Oscillators,http://arxiv.org/abs/1301.2035v1,"['D. Dutta', 'O. Panella', 'P. Roy']","  We study generalized Dirac oscillators with complex interactions in $(1+1)$
dimensions. It is shown that for the choice of interactions considered here,
the Dirac Hamiltonians are $\eta$ pseudo Hermitian with respect to certain
metric operators $\eta$. Exact solutions of the generalized Dirac Oscillator
for some choices of the interactions have also been obtained. It is also shown
that generalized Dirac oscillators can be identified with Anti Jaynes Cummings
type model and by spin flip it can also be identified with Jaynes Cummings type
model.
",Annals of Physics 331 (2013) 120-126,2013-01-10 06:41:56+00:00
The Physical Mirror Equivalence for the Local P^2,http://arxiv.org/abs/1301.4437v1,"['Sergio Luigi Cacciatori', 'Marco Compagnoni', 'Stefano Guerra']","  In this paper we consider the total space of the canonical bundle of P^2 and
we use a proposal by Hosono, together with results in Seidel and
Auroux-Katzarkov-Orlov, to deduce the right physical mirror equivalence between
D^b(K_{P^2}) and the derived Fukaya category of its mirror. By construction,
our equivalence is compatible with the mirror map between moduli spaces and
with the computation of Gromov--Witten invariants.
","Communications in Mathematical Physics, 333, 367-388 (2015)",2013-01-18 17:12:27+00:00
Numerical Methods and Causality in Physics,http://arxiv.org/abs/1302.5601v1,['Muhammad Adeel Ajaib'],"  We discuss physical implications of the explicit method in numerical
analysis. Numerical methods have there own condition for causality, known as
the Courant-Friedrichs-Lewy condition. It is proposed that numerical causality
merges with physical causality as the grid interval size approaches zero. We
discuss the implications of this proposition on the numerical analysis of the
wave equation. We also show that, insisting on physical causality, the
numerical analysis of Schrodinger's equation implies that the minimum space
interval should satisfy $\Delta x \ge a_0 \lambda_c$, where $\lambda_c$ is the
reduced Compton wavelength and $a_0$ is a constant of the order unity.
",None,2013-02-22 14:12:32+00:00
"Heuristic Classification of Physical Theories based on Quantum
  Correlations",http://arxiv.org/abs/1303.4011v1,"['M. Ferrero', 'J. L. Sánchez-Gómez']","  Taking quantum formalism as a point of reference and connection, we explore
the various possibilities that arise in the construction of physical theories.
Analyzing the distinct physical phenomena that each of them may describe, we
introduce the different types of hidden variables theories that correspond to
these physical phenomena. A hierarchical classification of the offered
theories, based on the degree of correlation between dichotomic observables in
bipartite systems, as quantified by a Bell type inequality, is finally
proposed.
",None,2013-03-16 19:17:32+00:00
Advancements in solar neutrino physics,http://arxiv.org/abs/1304.6304v1,"['Vito Antonelli', 'Lino Miramonti']","  We review the results of solar neutrino physics, with particular attention to
the data obtained and the analyses performed in the last decades, which were
determinant to solve the solar neutrino problem (SNP), proving that neutrinos
are massive and oscillating particles and contributing to refine the solar
models. We also discuss the perspectives of the presently running experiments
in this sector and of the ones planned for the near future and the impact they
can have on elementary particle physics and astrophysics.
","International Journal of Modern Physics E Online Ready 1330009
  (2013)",2013-04-23 14:38:52+00:00
Flavour physics in the LHC era,http://arxiv.org/abs/1306.4588v2,['Tim Gershon'],"  These lectures give a topical review of heavy flavour physics, in particular
\CP violation and rare decays, from an experimental point of view. They
describe the ongoing motivation to study heavy flavour physics in the LHC era,
the current status of the field emphasising key results from previous
experiments, some selected topics in which new results are expected in the near
future, and a brief look at future projects.
",None,2013-06-19 15:50:07+00:00
What can the Higgs tell us about UV physics?,http://arxiv.org/abs/1307.2513v1,['Alexander K Knochel'],"  After the discovery of a Higgs-like boson with a mass of m~125 GeV at the
LHC, we can now attempt to draw conclusions about physics beyond the Standard
Model. I argue that there are several hints towards new physics at intermediate
scales > 10^8 GeV. I review a class of stringy models with intermediate scale
SUSY which relate the observed Higgs mass to symmetries of the Higgs sector. I
then discuss radiative corrections to m_h, unification, dark matter and the
possibility of classically unstable UV completions in these models.
",None,2013-07-09 16:43:03+00:00
Generalization of the hypervirial and Feynman-Hellman theorems,http://arxiv.org/abs/1307.7972v1,"['Teimuraz Nadareishvili', 'Anzor Khelashvili']","  Using well-known methods we generalize (hyper)virial theorems to case of
singular potential. Discussion is carried on for most general second order
differential equation, which involves all physically interesting cases, such as
Schr\""odinger and two-body Klein-Gordon equations with singular potentials.
Some physical consequences are discussed. The connection with Feynman-Hellmann
like theorems are also considered and some relevant differences are underlined.
",None,2013-07-27 08:16:51+00:00
Institute for Molecular Physics at the University of Maryland,http://arxiv.org/abs/1308.1622v3,['Jan V. Sengers'],"  The Institute for Physical Science and Technology at the University of
Maryland was founded in 1976 from a merger of the Institute for Fluid Dynamics
and Applied Mathematics (IFDAM) and the Institute for Molecular Physics (IMP),
which were established at the College Park Campus after World War II to enhance
the expertise of the University of Maryland in some areas of science and
technology of interest to the US Department of Defense. Here I try to
reconstruct the history of the Institute for Molecular Physics at the
University of Maryland.
",None,2013-08-07 16:17:08+00:00
The Role of Dimensional Analysis in Teaching Physics,http://arxiv.org/abs/1308.6164v3,"['Michaela Reichelova', 'Aba Teleki']","  Dimensional analysis is a simple qualitative method for determining essential
connections between physical quantities. It is applicable to a multitude of
physics problems, many of which canbe introduced early on in a university
physics curriculum. Despite the relative simplicity of theapproach, it is
rarely included in physics curricula. Here, we apply dimensional analysis to
find the radiated power from an electric dipole. Employing dimensional
analysis, we demonstrate a straightforward way to derive the latter without the
need for complex mathematical treatments.
",None,2013-08-28 14:25:12+00:00
The Future of U.S. Particle Theory: Report of the DPF Theory Panel,http://arxiv.org/abs/1310.6111v2,"['M. Dine', 'K. Babu', 'C. Csaki', 'S. Dawson', 'L. Dixon', 'S. Gottlieb', 'J. Harvey', 'D. Whiteson']","  This report summarizes the findings of the DPF Theory Panel which was formed
with a goal of understanding the scientific problems and opportunities of the
next decade, as well as the challenges involved in sustaining a first-class
program in theoretical particle physics research in the United States.
",None,2013-10-23 05:07:00+00:00
Top-quark Pair Production in a Running Mass Scheme,http://arxiv.org/abs/1311.0643v1,"['Matthew Dowling', 'Sven Moch']","  Between the Tevatron and LHC, top-quark physics is now becoming an area for
precision physics. This has lead to an increase in theoretical activity to
match the experimental accuracy of top anti-top production. We discuss the
difficulty in properly defining the top-quark mass as measured by experiments
and present results for differential distributions of top-quark pair production
in a running mass scheme. The use of such a scheme shows better convergence in
the perturbative expansion and improves the scale dependence as opposed to the
typical on-shell scheme.
",None,2013-11-04 10:57:50+00:00
Higgs Physics,http://arxiv.org/abs/1312.5672v1,['John Ellis'],"  These lectures review the background to Higgs physics, its current status
following the discovery of a/the Higgs boson at the LHC, models of Higgs
physics beyond the Standard Model and prospects for Higgs studies in future
runs of the LHC and at possible future colliders.
",None,2013-12-19 18:00:03+00:00
Charm at Belle II - Status and Prospects,http://arxiv.org/abs/1312.6248v2,['Gagan B. Mohanty'],"  High-precision flavor physics measurements play a complementary role to the
direct searches for new physics by CMS and ATLAS experiments at LHC. Such
measurements will be performed with the Belle II detector at the upgraded KEKB
accelerator (SuperKEKB) in Japan. The physics potential with emphasis on the
charm sector, current status and future prospects of the Belle II experiment
are presented in these proceedings.
",None,2013-12-21 13:02:39+00:00
Topics in the Mathematical Physics of Cold Bose Gases,http://arxiv.org/abs/1402.0706v2,['Jakob Yngvason'],"  In these notes of six lectures on selected topics in the theory of cold,
dilute Bose gases, presented at the 5th Warsaw School of Statistical Physics in
June 2013, the following topics are discussed: 1) The concept of BEC, 2) the
ground state energy of a dilute Bose gas with short range interactions, 3)
Gross-Pitaevskii theory and BEC in trapped gases, 4) Bose gases in rotating
traps and quantized vortices, and 5) strongly correlated phases in the lowest
Landau level generated by rapid rotation.
",None,2014-02-04 12:23:04+00:00
"Quantum Humeanism,or: physicalism without properties",http://arxiv.org/abs/1403.5666v1,['Michael Esfeld'],"  In recent literature, it has become clear that quantum physics does not
refute Humeanism. This point has so far been made with respect to Bohms quantum
theory. Against this background, this paper seeks to achieve the following four
results: to generalize the option of quantum Humeanism from Bohmian mechanics
to primitive ontology theories in general, to show that this option applies
also to classical mechanics, to establish that it requires a commitment to
matter as primitive stuff, but no commitment to natural properties (physicalism
without properties, to point out that by removing the commitment to properties,
the stock metaphysical objections against Humeanism from quidditism and
humility no longer apply. In that way, quantum physics strengthens Humeanism
instead of refuting it.
",None,2014-03-22 14:21:50+00:00
"Illustrations of Equivalent Methods to Reproduce Vehicle and Occupant
  Dynamics as a Pedagogical Tool",http://arxiv.org/abs/1404.1542v1,"['Bob J. Scurlock', 'James R. Ipser']","  When explaining to a lay audience the magnitude of forces or accelerations
imparted to vehicles or experienced by vehicle occupants during a motor vehicle
collision, it is often helpful to recast the critical results in terms of other
physical systems or impact configurations which will reproduce the equivalent
dynamics of the subject accident to serve as a conceptual aid for the audience.
In this article, we present the basis for such equivalents and explicitly
demonstrate, using two physics simulation software packages, that such
equivalents are based on nothing more than the application of the laws of
physics.
",None,2014-04-06 02:45:05+00:00
Categorical Generalization and Physical Structuralism,http://arxiv.org/abs/1404.3049v1,"['Raymond Lal', 'Nicholas J. Teh']","  Category theory has become central to certain aspects of theoretical physics.
Bain [Synthese, 190:1621--1635 (2013)] has recently argued that this has
significance for ontic structural realism. We argue against this claim. In so
doing, we uncover two pervasive forms of category-theoretic generalization. We
call these `generalization by duality' and `generalization by categorifying
physical processes'. We describe in detail how these arise, and explain their
significance using detailed examples. We show that their significance is
two-fold: the articulation of high-level physical concepts, and the generation
of new models.
",None,2014-04-11 09:33:30+00:00
BSM Primary Effects,http://arxiv.org/abs/1405.0181v2,"['Rick S. Gupta', 'Alex Pomarol', 'Francesco Riva']","  Using the predictive power of the effective field theory approach, we present
a physical parametrization of the leading effects beyond the SM (BSM), that
give us at present the best way to constrain heavy new-physics at low-energies.
We show that other BSM effects are not independent from these ones, and we
provide the explicit correlations. This information is useful to know where to
primarily look for new physics in future experiments, and to know how this new
physics is related to previous measurements, most importantly in
electroweak-symmetry breaking processes or Higgs physics.
",None,2014-05-01 15:13:35+00:00
Qualitative analysis of trapped Dirac fermions in graphene,http://arxiv.org/abs/1405.2535v3,"['Vit Jakubsky', 'David Krejcirik']","  We study the confinement of Dirac fermions in graphene and in carbon
nanotubes by an external magnetic field, mechanical deformations or
inhomogeneities in the substrate. By applying variational principles to the
square of the Dirac operator, we obtain sufficient and necessary conditions for
confinement of the quasi-particles. The rigorous theoretical results are
illustrated on the realistic examples of the three classes of traps.
","Annals of Physics 349, 268 (2014)",2014-05-11 14:07:41+00:00
Top quarks as a probe for heavy new physics,http://arxiv.org/abs/1407.3183v1,['Celine Degrande'],"  The heaviest fermion is expected to couple strongly to new physics and
appears therefore as a natural probe in many BSM scenarios. Moreover, top
physics has now entered in a precision era thanks to the huge amount of top
quarks produced at hadron colliders, advanced experimental methods and accurate
theoretical predictions. In this talk, we will used effective field theory to
search for heavy new physics in a model independent way. This method can also
be used to quantify the room left for new physics if no deviation from the SM
is found.
",None,2014-07-11 14:57:28+00:00
An Integration of Integrated Information Theory with Fundamental Physics,http://arxiv.org/abs/1407.4706v1,['Adam B. Barrett'],"  To truly eliminate Cartesian ghosts from the science of consciousness, we
must describe consciousness as an aspect of the physical. Integrated
Information Theory states that consciousness arises from intrinsic information
generated by dynamical systems; however existing formulations of this theory
are not applicable to standard models of fundamental physical entities. Modern
physics has shown that fields are fundamental entities, and in particular that
the electromagnetic field is fundamental. Here I hypothesize that consciousness
arises from information intrinsic to fundamental fields. This hypothesis unites
fundamental physics with what we know empirically about the neuroscience
underlying consciousness, and it bypasses the need to consider quantum effects.
","Barrett AB (2014) An integration of integrated information theory
  with fundamental physics. Front. Psychol. 5:63",2014-07-03 13:33:45+00:00
"$SU(2)\times U(1)$ gauge invariance and the shape of new physics in rare
  $B$ decays",http://arxiv.org/abs/1407.7044v1,"['Rodrigo Alonso', 'Benjamin Grinstein', 'Jorge Martin Camalich']","  New physics effects in $B$ decays are routinely modeled through operators
invariant under the strong and electromagnetic gauge symmetries. Assuming the
scale for new physics is well above the electro-weak scale, we further require
invariance under the full Standard-Model gauge symmetry group. Retaining up to
dimension-6 operators, we unveil new constraints between different new-physics
operators that are assumed to be independent in the standard phenomenological
analyses. We illustrate this approach by analyzing the constraints on new
physics from rare $B_{q}$ (semi-)leptonic decays.
","Phys. Rev. Lett. 113, 241802 (2014)",2014-07-25 20:07:48+00:00
Model-Independent Searches Using Matrix Element Ranking,http://arxiv.org/abs/1408.6572v1,"['Dipsikha Debnath', 'James S. Gainer', 'Konstantin T. Matchev']","  Thus far the LHC experiments have yet to discover beyond-the-standard-model
physics. This motivates efforts to search for new physics in model independent
ways. In this spirit, we describe procedures for using a variant of the Matrix
Element Method to search for new physics without regard to a specific signal
hypothesis. To make the resulting variables more intuitive, we also describe
how these variables can be ""flattened"", which makes the resulting distributions
more visually meaningful.
",None,2014-08-27 21:28:07+00:00
"Searches for Leptoquarks, Extra Dimensions, and Dark Matter",http://arxiv.org/abs/1409.4479v2,['Lovedeep Kaur Saini'],"  We present results from several searches for various exotic physics phenomena
like large extra dimensions, leptoquarks, and dark matter, in proton-proton
collisions at $\sqrt{s}$ = 7 and 8 TeV delivered by the LHC and collected with
the CMS detector. Many different final states are analyzed using data collected
in 2011 and 2012 corresponding to an integrated luminosity up to 5.0 fb$^{-1}$
and 19.7 fb$^{-1}$. No sign of physics beyond the standard model has been
observed so far and the results are used to set new limits on various new
physics model parameters.
",None,2014-09-16 01:25:46+00:00
Boundary Effects in Bosonic and Fermionic Field Theories,http://arxiv.org/abs/1501.03752v1,"['M. Asorey', 'D. Garcia-Alvarez', 'J. M. Munoz-Castaneda']","  The dynamics of quantum field theories on bounded domains requires the
introduction of boundary conditions on the quantum fields. We address the
problem from a very general perspective by using charge conservation as a
fundamental principle for scalar and fermionic quantum field theories.
Unitarity arises as a consequence of the choice of charge preserving boundary
conditions. This provides a powerful framework for the analysis of global
geometrical and topological properties of the space of physical boundary
conditions. Boundary conditions which allow the existence of edge states can
only arise in theories with a mass gap which is also a physical requirement for
topological insulators.
",None,2015-01-15 17:37:26+00:00
Biology and nonequilibrium: remarks on a paper by J.L. England,http://arxiv.org/abs/1502.01600v1,['David Ruelle'],"  This note analyzes the physical basis of J.R. England's paper ""Statistical
physics of self-replication."" [J. Chem. Phys. {\bf 139}, 121923(2013)]. We
follow England's use of time-reversal symmetry but replace stochastic by
deterministic dynamics, and introduce a definition of metastable states based
on equilibrium statistical mechanics. We rederive England's detailed balance
relation and obtain another similar relation which appears more natural and
remains valid for quantum systems. The detailed balance relations are based on
serious physical ideas, and either of them can be used for England's biological
discussion. This biological discussion does of course deserve further scrutiny.
",None,2015-02-05 15:09:28+00:00
